{
  "activation_status": "ACTIVE",
  "compatible_release_schema_major": 5,
  "definitions": [
    {
      "active": true,
      "applicability": {
        "dimensions": [
          "EMPLOYMENT_ECOSYSTEM"
        ],
        "mode": "DESTINATION_SIDE"
      },
      "availability": "AVAILABLE",
      "compactName": "Technology and software",
      "construct": "Employment in ISCO-08 groups 25 and 35, measured as national scale and share.",
      "displayName": "Technology and software employment ecosystem",
      "documentation_ref": "docs/data/career-opportunity-evidence.md",
      "does_not_mean": [
        "Live vacancies or hiring probability",
        "Salary or job quality",
        "Licensing or qualification recognition",
        "Visa access or applicant success",
        "Absence of employment when a strong signal is not established"
      ],
      "evidence_policy_version": "opportunity-filter-evidence-policy-1.1",
      "filter_behavior": {
        "changes_affinity_score": false,
        "changes_survivor_order": false,
        "combination": "ALL_SELECTED_REQUIRED",
        "eligibility_state": "VERIFIED_STRONG_SIGNAL"
      },
      "id": "technology_software_opportunity",
      "meaning": "A substantial and established technology/software employment ecosystem.",
      "product_role": "OPPORTUNITY_FILTER",
      "refresh_policy": {
        "cadence": "SOURCE_RELEASE",
        "fail_closed": true,
        "maximum_age_months": 72,
        "policy_id": "career-opportunity-source-release-review-1.0"
      },
      "scope": {
        "derivation": "DIRECT",
        "evidence_level": "COUNTRY",
        "result_level": "COUNTRY"
      },
      "sectionId": "career",
      "sectionName": "Career",
      "sortOrder": 10,
      "source_bundle_version": "complete-opportunity-source-bundle-2026-08-03.1",
      "source_dependency": {
        "failure_state": "INSUFFICIENT_EVIDENCE",
        "mode": "MULTI_SOURCE",
        "required_source_ids": [
          "ilo_observed_occupation_oc2",
          "statcan_2021_census_noc",
          "eurostat_lfsa_egai2d"
        ]
      },
      "state_contract_version": "opportunity-filter-state-1.0",
      "threshold_policy_version": "career-p60-technology_software_opportunity-1.0"
    },
    {
      "active": true,
      "applicability": {
        "dimensions": [
          "EMPLOYMENT_ECOSYSTEM"
        ],
        "mode": "DESTINATION_SIDE"
      },
      "availability": "AVAILABLE",
      "compactName": "Science and engineering",
      "construct": "Employment in ISCO-08 groups 21 and 31, measured as national scale and share.",
      "displayName": "Science and engineering employment ecosystem",
      "documentation_ref": "docs/data/career-opportunity-evidence.md",
      "does_not_mean": [
        "Live vacancies or hiring probability",
        "Salary or job quality",
        "Licensing or qualification recognition",
        "Visa access or applicant success",
        "Absence of employment when a strong signal is not established"
      ],
      "evidence_policy_version": "opportunity-filter-evidence-policy-1.1",
      "filter_behavior": {
        "changes_affinity_score": false,
        "changes_survivor_order": false,
        "combination": "ALL_SELECTED_REQUIRED",
        "eligibility_state": "VERIFIED_STRONG_SIGNAL"
      },
      "id": "science_engineering_opportunity",
      "meaning": "A substantial and established science/engineering employment ecosystem.",
      "product_role": "OPPORTUNITY_FILTER",
      "refresh_policy": {
        "cadence": "SOURCE_RELEASE",
        "fail_closed": true,
        "maximum_age_months": 72,
        "policy_id": "career-opportunity-source-release-review-1.0"
      },
      "scope": {
        "derivation": "DIRECT",
        "evidence_level": "COUNTRY",
        "result_level": "COUNTRY"
      },
      "sectionId": "career",
      "sectionName": "Career",
      "sortOrder": 20,
      "source_bundle_version": "complete-opportunity-source-bundle-2026-08-03.1",
      "source_dependency": {
        "failure_state": "INSUFFICIENT_EVIDENCE",
        "mode": "MULTI_SOURCE",
        "required_source_ids": [
          "ilo_observed_occupation_oc2",
          "eurostat_lfsa_egai2d"
        ]
      },
      "state_contract_version": "opportunity-filter-state-1.0",
      "threshold_policy_version": "career-p60-science_engineering_opportunity-1.0"
    },
    {
      "active": true,
      "applicability": {
        "dimensions": [
          "EMPLOYMENT_ECOSYSTEM"
        ],
        "mode": "DESTINATION_SIDE"
      },
      "availability": "AVAILABLE",
      "compactName": "Care sector",
      "construct": "Employment in ISIC Rev.4 section Q (human health and social work), measured as national scale and share.",
      "displayName": "Care-sector employment ecosystem",
      "documentation_ref": "docs/data/career-opportunity-evidence.md",
      "does_not_mean": [
        "Live vacancies or hiring probability",
        "Salary or job quality",
        "Licensing or qualification recognition",
        "Visa access or applicant success",
        "Absence of employment when a strong signal is not established"
      ],
      "evidence_policy_version": "opportunity-filter-evidence-policy-1.1",
      "filter_behavior": {
        "changes_affinity_score": false,
        "changes_survivor_order": false,
        "combination": "ALL_SELECTED_REQUIRED",
        "eligibility_state": "VERIFIED_STRONG_SIGNAL"
      },
      "id": "health_social_work_opportunity",
      "meaning": "A substantial and established care-sector employment ecosystem.",
      "product_role": "OPPORTUNITY_FILTER",
      "refresh_policy": {
        "cadence": "SOURCE_RELEASE",
        "fail_closed": true,
        "maximum_age_months": 36,
        "policy_id": "career-opportunity-source-release-review-1.0"
      },
      "scope": {
        "derivation": "DIRECT",
        "evidence_level": "COUNTRY",
        "result_level": "COUNTRY"
      },
      "sectionId": "career",
      "sectionName": "Career",
      "sortOrder": 30,
      "source_bundle_version": "complete-opportunity-source-bundle-2026-08-03.1",
      "source_dependency": {
        "failure_state": "INSUFFICIENT_EVIDENCE",
        "mode": "SINGLE_SOURCE",
        "required_source_ids": [
          "ilo_modelled_economic_activity_2025"
        ]
      },
      "state_contract_version": "opportunity-filter-state-1.0",
      "threshold_policy_version": "career-p60-health_social_work_opportunity-1.0"
    },
    {
      "active": true,
      "applicability": {
        "dimensions": [
          "EMPLOYMENT_ECOSYSTEM"
        ],
        "mode": "DESTINATION_SIDE"
      },
      "availability": "AVAILABLE",
      "compactName": "Finance and insurance",
      "construct": "Employment in ISIC Rev.4 section K, measured as national scale and share.",
      "displayName": "Finance and insurance employment ecosystem",
      "documentation_ref": "docs/data/career-opportunity-evidence.md",
      "does_not_mean": [
        "Live vacancies or hiring probability",
        "Salary or job quality",
        "Licensing or qualification recognition",
        "Visa access or applicant success",
        "Absence of employment when a strong signal is not established"
      ],
      "evidence_policy_version": "opportunity-filter-evidence-policy-1.1",
      "filter_behavior": {
        "changes_affinity_score": false,
        "changes_survivor_order": false,
        "combination": "ALL_SELECTED_REQUIRED",
        "eligibility_state": "VERIFIED_STRONG_SIGNAL"
      },
      "id": "finance_insurance_opportunity",
      "meaning": "A substantial and established finance and insurance employment ecosystem.",
      "product_role": "OPPORTUNITY_FILTER",
      "refresh_policy": {
        "cadence": "SOURCE_RELEASE",
        "fail_closed": true,
        "maximum_age_months": 36,
        "policy_id": "career-opportunity-source-release-review-1.0"
      },
      "scope": {
        "derivation": "DIRECT",
        "evidence_level": "COUNTRY",
        "result_level": "COUNTRY"
      },
      "sectionId": "career",
      "sectionName": "Career",
      "sortOrder": 40,
      "source_bundle_version": "complete-opportunity-source-bundle-2026-08-03.1",
      "source_dependency": {
        "failure_state": "INSUFFICIENT_EVIDENCE",
        "mode": "SINGLE_SOURCE",
        "required_source_ids": [
          "ilo_modelled_economic_activity_2025"
        ]
      },
      "state_contract_version": "opportunity-filter-state-1.0",
      "threshold_policy_version": "career-p60-finance_insurance_opportunity-1.0"
    },
    {
      "active": true,
      "applicability": {
        "dimensions": [
          "EMPLOYMENT_ECOSYSTEM"
        ],
        "mode": "DESTINATION_SIDE"
      },
      "availability": "AVAILABLE",
      "compactName": "Skilled trades or construction",
      "construct": "ISCO-08 major group 7 employment OR ISIC Rev.4 section F construction employment, with both routes retained separately.",
      "displayName": "Skilled-trades or construction employment ecosystem",
      "documentation_ref": "docs/data/career-opportunity-evidence.md",
      "does_not_mean": [
        "Live vacancies or hiring probability",
        "Salary or job quality",
        "Licensing or qualification recognition",
        "Visa access or applicant success",
        "Absence of employment when a strong signal is not established"
      ],
      "evidence_policy_version": "opportunity-filter-evidence-policy-1.1",
      "filter_behavior": {
        "changes_affinity_score": false,
        "changes_survivor_order": false,
        "combination": "ALL_SELECTED_REQUIRED",
        "eligibility_state": "VERIFIED_STRONG_SIGNAL"
      },
      "id": "skilled_trades_construction_opportunity",
      "meaning": "A substantial and established skilled-trades or construction employment ecosystem.",
      "product_role": "OPPORTUNITY_FILTER",
      "refresh_policy": {
        "cadence": "SOURCE_RELEASE",